[
  {
    "id": "F01",
    "behavior": "shaping ships >=4 well-formed evals, written before the skill content",
    "verification": "node tests/run-eval-checks.mjs",
    "state": "passing",
    "evidence": "exit 0 (shaping: 4 evals well-formed) — 2026-08-18, run by the fresh-context reviewer and re-run by the controller post-F06 fix"
  },
  {
    "id": "F02",
    "behavior": "skills/shaping/SKILL.md exists and the repo passes the self-lint with it",
    "verification": "node scripts/agent-lint.mjs . --ignore tests,templates,global,examples",
    "state": "passing",
    "evidence": "exit 0 (0 high, 0 medium, 0 low) — 2026-08-18, reviewer + controller runs"
  },
  {
    "id": "F03",
    "behavior": "ADR-006 exists and reference/skills.md supersedes brainstorming citing it",
    "verification": "node -e \"const fs=require('fs');if(!fs.existsSync('docs/adrs/ADR-006-design-dialogue.md'))process.exit(1);const s=fs.readFileSync('reference/skills.md','utf8');process.exit(s.includes('brainstorming') && s.includes('ADR-006')?0:1)\"",
    "state": "passing",
    "evidence": "exit 0 — 2026-08-18, reviewer + controller runs"
  },
  {
    "id": "F04",
    "behavior": "work-plan refusal points at shaping and using-ae's map carries the shaping row",
    "verification": "node -e \"const fs=require('fs');const wp=fs.readFileSync('skills/work-plan/SKILL.md','utf8');const ua=fs.readFileSync('skills/using-ae/SKILL.md','utf8');process.exit(wp.includes('shaping') && ua.includes('shaping')?0:1)\"",
    "state": "passing",
    "evidence": "exit 0 — 2026-08-18, reviewer + controller runs"
  },
  {
    "id": "F05",
    "behavior": "README documents ten skills with shaping in the chain; both affected how-it-works chapters mention it",
    "verification": "node -e \"const fs=require('fs');const r=fs.readFileSync('README.md','utf8');const wl=fs.readFileSync('docs/how-it-works/work-lifecycle.md','utf8');const sl=fs.readFileSync('docs/how-it-works/standard-lifecycle.md','utf8');process.exit(r.includes('ten skills') && r.includes('shaping') && wl.includes('shaping') && sl.includes('shaping')?0:1)\"",
    "state": "passing",
    "evidence": "exit 0 — 2026-08-18, reviewer + controller runs"
  },
  {
    "id": "F06",
    "behavior": "the 1.2.2 package release entry exists covering templates + shaping (ADR-007 sizing; renumbered from 1.3.1 by the owner mid-lane)",
    "verification": "node -e \"const fs=require('fs');const c=fs.readFileSync('CHANGELOG.md','utf8');process.exit(c.includes('[1.2.2]')?0:1)\"",
    "state": "passing",
    "evidence": "exit 0 — 2026-08-18, controller run post-fix (the reviewer's FAIL was the stale [1.3.1] string, corrected with a recorded ruling)"
  }
]
