[
  {
    "id": "F01",
    "behavior": "skill-authoring ships >=4 well-formed evals, written before the skill content and derived from observed baseline failures",
    "verification": "node tests/run-eval-checks.mjs",
    "state": "not_started",
    "evidence": null
  },
  {
    "id": "F02",
    "behavior": "skills/skill-authoring/SKILL.md exists, carries the RED-GREEN-REFACTOR cycle and the form-matching table, cites reference/skills.md for the law, and the repo passes the self-lint with it",
    "verification": "node -e \"const fs=require('fs');const s=fs.readFileSync('skills/skill-authoring/SKILL.md','utf8');process.exit(/REFACTOR/.test(s)&&/[Ff]orm/.test(s)&&s.includes('reference/skills.md')?0:1)\" && node scripts/agent-lint.mjs . --ignore tests,templates,global,examples",
    "state": "not_started",
    "evidence": null
  },
  {
    "id": "F03",
    "behavior": "the one reference file exists exactly one level deep, opens with a table of contents, and is the link SKILL.md actually points at",
    "verification": "node -e \"const fs=require('fs');const p='skills/skill-authoring/references/testing-with-subagents.md';if(!fs.existsSync(p))process.exit(1);const r=fs.readFileSync(p,'utf8');const s=fs.readFileSync('skills/skill-authoring/SKILL.md','utf8');process.exit(/Contents/.test(r.slice(0,800))&&s.includes('references/testing-with-subagents.md')?0:1)\"",
    "state": "not_started",
    "evidence": null
  },
  {
    "id": "F04",
    "behavior": "reference/skills.md supersedes writing-skills with skill-authoring citing ADR-005, carries the forward bygama/skills rows, and holds its <=120-line budget",
    "verification": "node -e \"const fs=require('fs');const s=fs.readFileSync('reference/skills.md','utf8');const a=s.split('\n');const n=a.at(-1)===''?a.length-1:a.length;process.exit(s.includes('writing-skills')&&s.includes('skill-authoring')&&s.includes('ADR-005')&&s.includes('tracing-root-causes')&&n<=120?0:1)\"",
    "state": "not_started",
    "evidence": null
  },
  {
    "id": "F05",
    "behavior": "README and architecture.md both document eleven skills with skill-authoring enumerated",
    "verification": "node -e \"const fs=require('fs');const r=fs.readFileSync('README.md','utf8');const a=fs.readFileSync('docs/how-it-works/architecture.md','utf8');process.exit(/eleven skills/.test(r)&&r.includes('skill-authoring')&&/all eleven/.test(a)&&a.includes('skill-authoring')?0:1)\"",
    "state": "not_started",
    "evidence": null
  },
  {
    "id": "F06",
    "behavior": "all four gates exit 0 on the finished lane",
    "verification": "node scripts/agent-lint.mjs . --ignore tests,templates,global,examples && node tests/run-lint-tests.mjs && node tests/run-gen-tests.mjs && node tests/run-eval-checks.mjs",
    "state": "not_started",
    "evidence": null
  }
]
